{
  "metadata": {
    "title": "Säkerhetsgranskning",
    "system_name": "Exempelsystem",
    "review_date": null,
    "review_mode": "standard",
    "version": "0.1.0-rc.1",
    "source_reference": null
  },
  "executive_summary": {
    "overall_assessment": "Exempelbedömning.",
    "key_findings": [],
    "key_uncertainties": [
      "Produktions-IAM ej verifierbar."
    ],
    "next_steps": [
      "Verifiera IAM."
    ],
    "audience_guidance": {
      "developer": [
        "Åtgärda verifierade fynd i prioriteringsordning och använd acceptance criteria som Definition of Done."
      ],
      "security_reviewer": [
        "Använd attackytekartan, coverage och follow-up för att avgöra vilken manuell verifiering som återstår."
      ]
    }
  },
  "scope": {
    "requested_scope": "Kod och arkitektur.",
    "reviewed_material": [
      "Backend"
    ],
    "limitations": [
      "Runtime-IAM saknas."
    ]
  },
  "system_overview": {
    "frontend": [],
    "backend": [
      "Jakarta EE"
    ],
    "data_stores": [
      "PostgreSQL"
    ],
    "integrations": [],
    "deployment": [],
    "major_components": [
      {
        "name": "Webbklient",
        "type": "frontend",
        "technology": "React",
        "responsibility": "Användargränssnitt",
        "deployment_unit": "Frontend/webb"
      },
      {
        "name": "Backend API",
        "type": "backend",
        "technology": "Jakarta EE / JAX-RS",
        "responsibility": "API, affärslogik och auktorisering",
        "deployment_unit": "Backend"
      },
      {
        "name": "Applikationsdatabas",
        "type": "data_store",
        "technology": "PostgreSQL",
        "responsibility": "Persistens av order- och applikationsdata",
        "deployment_unit": "PostgreSQL"
      }
    ],
    "actors": [
      "Autentiserad användare",
      "Systemadministratör"
    ],
    "external_systems": [
      "Extern IdP"
    ]
  },
  "architecture_security": {
    "trust_boundaries": [],
    "authentication_points": [],
    "authorization_points": [],
    "administrative_interfaces": [],
    "sensitive_data_flows": [],
    "observations": []
  },
  "findings": [],
  "coverage": {
    "reviewed": [
      "Backend"
    ],
    "not_reviewed": [],
    "not_verifiable": [
      "Produktions-IAM"
    ]
  },
  "recommended_actions": [
    {
      "priority": "normal",
      "action": "Verifiera IAM.",
      "reason": "Runtimekonfiguration saknas.",
      "related_findings": []
    }
  ],
  "follow_up_review": [
    {
      "type": "configuration-review",
      "priority": "normal",
      "reason": "IAM ligger utanför repo.",
      "scope": "Produktions-IAM",
      "verification_goal": "Verifiera roller och policyer."
    }
  ],
  "residual_risk": {
    "summary": "IAM kan inte bedömas fullt ut.",
    "from_findings": [],
    "from_unverified": [
      "IAM"
    ],
    "from_out_of_scope": []
  },
  "appendix": {
    "method": [
      "Standard review"
    ],
    "evidence_register": [],
    "profiles_used": [
      "java-jakarta"
    ],
    "references": []
  },
  "analyzed_security_flows": [
    {
      "flow": "Webbläsare → backend API",
      "review_focus": "Autentisering, sessions-/identitetspropagering och auktorisering",
      "status": "reviewed",
      "evidence_basis": "Backendkod och arkitekturbeskrivning",
      "result_next_step": "Ingen särskild fortsatt granskning utöver identifierade fynd."
    },
    {
      "flow": "Backend API → PostgreSQL",
      "review_focus": "Objektbehörighet, query-hantering och databasåtkomst",
      "status": "reviewed",
      "evidence_basis": "JAX-RS/JPA-access och PostgreSQL-relaterad kod",
      "result_next_step": "Ingen särskild fortsatt granskning utöver identifierade fynd."
    },
    {
      "flow": "Extern IdP → backend/runtime",
      "review_focus": "Produktions-IAM, claims och policykoppling",
      "status": "not_verifiable",
      "evidence_basis": "Produktions-IAM-konfiguration saknas i underlaget",
      "result_next_step": "Manuell/configuration review krävs innan starkare slutsats."
    }
  ],
  "review_process": {
    "control_matrix": [
      {
        "control_family": "authentication/session",
        "status": "reviewed",
        "note": "Täcks av fixture för processvalidering.",
        "evidence_refs": [
          "tests/fixtures/report-standard-example.json#synthetic-authentication"
        ]
      },
      {
        "control_family": "authorization/object ownership/current authorization",
        "status": "reviewed",
        "note": "Täcks av fixture för processvalidering.",
        "evidence_refs": [
          "tests/fixtures/report-standard-example.json#synthetic-authorization"
        ]
      },
      {
        "control_family": "input/archive/path handling",
        "status": "reviewed",
        "note": "Täcks av fixture för processvalidering.",
        "evidence_refs": [
          "tests/fixtures/report-standard-example.json#synthetic-input"
        ]
      },
      {
        "control_family": "injection/output/browser sinks",
        "status": "reviewed",
        "note": "Täcks av fixture för processvalidering.",
        "evidence_refs": [
          "tests/fixtures/report-standard-example.json#synthetic-injection"
        ]
      },
      {
        "control_family": "secrets/cryptography",
        "status": "reviewed",
        "note": "Täcks av fixture för processvalidering.",
        "evidence_refs": [
          "tests/fixtures/report-standard-example.json#synthetic-secrets"
        ]
      },
      {
        "control_family": "external HTTP/API integrations",
        "status": "reviewed",
        "note": "Täcks av fixture för processvalidering.",
        "evidence_refs": [
          "tests/fixtures/report-standard-example.json#synthetic-external-HTTP"
        ]
      },
      {
        "control_family": "local process/Git/file-system operations",
        "status": "reviewed",
        "note": "Täcks av fixture för processvalidering.",
        "evidence_refs": [
          "tests/fixtures/report-standard-example.json#synthetic-local-process"
        ]
      },
      {
        "control_family": "data stores",
        "status": "reviewed",
        "note": "Täcks av fixture för processvalidering.",
        "evidence_refs": [
          "tests/fixtures/report-standard-example.json#synthetic-data-stores"
        ]
      },
      {
        "control_family": "resource consumption/timeouts/concurrency",
        "status": "reviewed",
        "note": "Täcks av fixture för processvalidering.",
        "evidence_refs": [
          "tests/fixtures/report-standard-example.json#synthetic-resource-consumption"
        ]
      },
      {
        "control_family": "error handling/logging/audit",
        "status": "reviewed",
        "note": "Täcks av fixture för processvalidering.",
        "evidence_refs": [
          "tests/fixtures/report-standard-example.json#synthetic-error-handling"
        ]
      },
      {
        "control_family": "dependency/supply chain",
        "status": "reviewed",
        "note": "Täcks av fixture för processvalidering.",
        "evidence_refs": [
          "tests/fixtures/report-standard-example.json#synthetic-dependency"
        ]
      },
      {
        "control_family": "deployment/runtime/network exposure",
        "status": "reviewed",
        "note": "Täcks av fixture för processvalidering.",
        "evidence_refs": [
          "tests/fixtures/report-standard-example.json#synthetic-deployment"
        ]
      },
      {
        "control_family": "architecture/trust boundaries/privilege boundaries",
        "status": "reviewed",
        "note": "Täcks av fixture för processvalidering.",
        "evidence_refs": [
          "tests/fixtures/report-standard-example.json#synthetic-architecture"
        ]
      }
    ],
    "candidate_findings": [
      {
        "candidate_id": "CAND-900",
        "title": "Exempel på motbevisad kandidat",
        "disposition": "dismissed",
        "finding_id": null,
        "merged_into": null,
        "rationale": "Motbevisande evidens visar att den relevanta kontrollen finns i den aktiva kodvägen.",
        "source_pass": "challenge-pass"
      }
    ],
    "challenge_completed": true,
    "coverage_gate_passed": true
  }
}
